{
  "source_map_version": "DAE-SOURCE-MAP-1.0",
  "engine_version": "0.10.0-alpha.1",
  "generated_at": "2026-08-11T19:20:41Z",
  "document_source_id": "LOCAL-SHA256-61777D6D2598353D90C326E8A2E148AB4B27258EB38CAF43FD64AD9E921240AF",
  "document_artifact": {
    "sha256": "7bf14bbdb666d3feeb9684aa990ce097df0166c1e80854efdcd44278d7ae1d6b",
    "role": "COMPOSITE_CONTAINER",
    "admission": "LOCAL_HASH"
  },
  "catalog_targets": [],
  "ga_volume_candidates": [],
  "unresolved_marker_clusters": [],
  "coverage": {
    "segments_scanned": 4,
    "segments_with_catalog_alias": 0,
    "segments_with_ga_locator": 0,
    "pseudo_citation_occurrences": 0,
    "hyperlink_occurrences": 0,
    "resolved_claim_level_citations": 0
  },
  "claim_ceiling": "SOURCE_TARGET_AND_CITATION_MARKER_CANDIDATES_ONLY_NOT_CLAIM_LEVEL_SOURCE_RESOLUTION"
}
