{
  "source_map_version": "DAE-SOURCE-MAP-1.0",
  "engine_version": "0.7.0-alpha.1",
  "generated_at": "2026-08-11T16:15:37Z",
  "document_source_id": "LOCAL-SHA256-A731F5F0A34DB63303D2D4DB4F8FC3EF1381E31F974272A72D5689E971233B03",
  "document_artifact": {
    "sha256": "da622aaad49736efbe391ffba688a18b81db1f46f796ca16a3673ddcf910c0fc",
    "role": "COMPOSITE_CONTAINER",
    "admission": "LOCAL_HASH"
  },
  "catalog_targets": [
    {
      "catalog_source_id": "HGA-BEYNG-CATALOG",
      "catalog_kind": "SECONDARY_NAVIGATION_INDEX",
      "resolution_status": "LEXICAL_ALIAS_CANDIDATE",
      "evidence_basis": [
        "ALIAS_PATTERN_1"
      ],
      "mention_count": 7,
      "selectors": [
        "OX-P000037-2371676E2D",
        "OX-P000038-0D92D84132",
        "OX-P000039-8425289A67",
        "OX-P000040-0A920546FB",
        "OX-P000041-3D76547526",
        "OX-P000042-F885728C86",
        "OX-P000043-C869C09825"
      ],
      "selectors_truncated": false,
      "human_review_required": true
    }
  ],
  "ga_volume_candidates": [
    {
      "volume": 7,
      "mention_count": 24,
      "selectors": [
        "OX-P000005-A7C0AB5A6D",
        "OX-P000006-886544C19B",
        "OX-P000007-4DC9235482",
        "OX-P000008-E3F38287D5",
        "OX-P000009-3268FFFD53",
        "OX-P000010-407A6F7C18",
        "OX-P000038-0D92D84132",
        "OX-P000039-8425289A67",
        "OX-P000040-0A920546FB",
        "OX-P000041-3D76547526",
        "OX-P000042-F885728C86",
        "OX-P000043-C869C09825"
      ],
      "resolution_status": "VOLUME_LOCATOR_ONLY"
    },
    {
      "volume": 79,
      "mention_count": 5,
      "selectors": [
        "OX-P000004-FE7A82725C",
        "OX-P000012-7C9F28048E",
        "OX-P000037-2371676E2D"
      ],
      "resolution_status": "VOLUME_LOCATOR_ONLY"
    }
  ],
  "unresolved_marker_clusters": [],
  "coverage": {
    "segments_scanned": 43,
    "segments_with_catalog_alias": 7,
    "segments_with_ga_locator": 15,
    "pseudo_citation_occurrences": 0,
    "hyperlink_occurrences": 0,
    "resolved_claim_level_citations": 0
  },
  "claim_ceiling": "SOURCE_TARGET_AND_CITATION_MARKER_CANDIDATES_ONLY_NOT_CLAIM_LEVEL_SOURCE_RESOLUTION"
}
