{
  "source_map_version": "DAE-SOURCE-MAP-1.0",
  "engine_version": "0.10.0-alpha.1",
  "generated_at": "2026-08-11T19:20:58Z",
  "document_source_id": "LOCAL-SHA256-B85AD72302E5980C2E7F58680CB4BE010315CA60B42CA3DB520C6A788B345DE3",
  "document_artifact": {
    "sha256": "96909cc2bd36e6bb3646a62a2c50a3fb04bfe3863db993863826b672df7922b5",
    "role": "COMPOSITE_CONTAINER",
    "admission": "LOCAL_HASH"
  },
  "catalog_targets": [],
  "ga_volume_candidates": [],
  "unresolved_marker_clusters": [],
  "coverage": {
    "segments_scanned": 5,
    "segments_with_catalog_alias": 0,
    "segments_with_ga_locator": 0,
    "pseudo_citation_occurrences": 0,
    "hyperlink_occurrences": 0,
    "resolved_claim_level_citations": 0
  },
  "claim_ceiling": "SOURCE_TARGET_AND_CITATION_MARKER_CANDIDATES_ONLY_NOT_CLAIM_LEVEL_SOURCE_RESOLUTION"
}
