{
  "source_map_version": "DAE-SOURCE-MAP-1.0",
  "engine_version": "0.10.0-alpha.1",
  "generated_at": "2026-08-11T19:20:25Z",
  "document_source_id": "LOCAL-SHA256-69F836088BAC2420BA02C7009B5B3588539C11FEB0397A00EB4E93E47763506C",
  "document_artifact": {
    "sha256": "572b65db8157415e2774c1d6bc130cb1120a14b5ccd5ffaebd095cbabec04893",
    "role": "COMPOSITE_CONTAINER",
    "admission": "LOCAL_HASH"
  },
  "catalog_targets": [],
  "ga_volume_candidates": [],
  "unresolved_marker_clusters": [],
  "coverage": {
    "segments_scanned": 4,
    "segments_with_catalog_alias": 0,
    "segments_with_ga_locator": 0,
    "pseudo_citation_occurrences": 0,
    "hyperlink_occurrences": 0,
    "resolved_claim_level_citations": 0
  },
  "claim_ceiling": "SOURCE_TARGET_AND_CITATION_MARKER_CANDIDATES_ONLY_NOT_CLAIM_LEVEL_SOURCE_RESOLUTION"
}
